{
  "title": "我的相册",
  "sourceType": "album",
  "sourceId": "unconfigured",
  "sourceRevision": 1,
  "recursive": false,
  "selection": "random",
  "fixedImageId": "",
  "rotationSeconds": 3600,
  "noRepeat": true,
  "fit": "contain",
  "grayscale": true,
  "showTitle": true,
  "showCaption": false,
  "showBorder": false,
  "padding": 8
}
